{"schemaVersion":"1.0","taskId":93,"contextHash":"ffffffffffffffffffffffffffffffffffffffffffffffffffffffffffffffff","tradeDate":"2026-07-14","ruleVersion":"1.4.0-stage-2d-market-regime-v1","executionMode":"LOCAL_RULES","agentRuns":[{"schemaVersion":"1.0","taskId":93,"runId":331,"agentCode":"DATA_QUALITY","status":"COMPLETED","gateStatus":"BLOCKED","decision":"REJECT","veto":false,"score":0,"confidence":100,"summary":"数据质量规则发现阻断事实，本次团队分析已停止。","findings":[{"findingId":"dq-20-security-record-missing","code":"SECURITY_RECORD_MISSING","severity":"HIGH","title":"证券基础事实缺失","detail":"本地数据库中不存在请求证券的基础记录。","evidenceIds":["dq-context-ffffffffffffffffffffffffffffffffffffffffffffffffffffffffffffffff"]}],"evidence":[{"evidenceId":"dq-context-ffffffffffffffffffffffffffffffffffffffffffffffffffffffffffffffff","category":"DATA_QUALITY","sourceType":"JAVA_ENGINE","sourceName":"AgentContextSnapshotService","sourceRef":"contextSnapshot","symbol":"600000","tradeDate":"2026-07-14","observedAt":"2026-07-14T05:00:00Z","collectedAt":"2026-07-14T05:01:00Z","fields":{"security":{"available":false,"queriedAt":"2026-07-14T05:00:00Z","queryScope":{"symbol":"600000","tradeDate":"2026-07-14"}},"marketData":{"available":true,"queriedAt":"2026-07-14T05:00:00Z","queryScope":{"symbol":"600000","tradeDate":"2026-07-14"},"adjustType":"QFQ","requestedTradeDate":"2026-07-14","effectiveTradeDate":"2026-07-14","exactTradeDateMatch":true,"actualBars":61,"bars":[]},"technicalMetrics":{"available":true,"queriedAt":"2026-07-14T05:00:00Z","queryScope":{"symbol":"600000","tradeDate":"2026-07-14"},"formulaVersion":"JAVA_INDICATORS_V1","adjustType":"QFQ","requestedTradeDate":"2026-07-14","effectiveTradeDate":"2026-07-14","requiredBars":61,"actualBars":61,"values":{}},"dataQualityContext":{"available":true,"queriedAt":"2026-07-14T05:00:00Z","queryScope":{"symbol":"600000","tradeDate":"2026-07-14"},"facts":{"securityRecordPresent":false,"securityPlaceholderSuspected":false,"securitySourceKnown":false,"securityPointInTimeGuaranteed":false,"loadedBarCount":61,"requiredBarsForTechnicalMetrics":61,"exactTradeDatePresent":true,"requestedTradeDate":"2026-07-14","effectiveTradeDate":"2026-07-14","naturalDayLag":0,"tradingCalendarAvailable":true,"missingAmountCount":0,"missingTurnoverRateCount":0,"invalidBarCount":0,"invalidBarDates":[],"maximumObservedNaturalDayGap":1,"duplicateProtection":"PRIMARY_KEY_SYMBOL_TRADE_DATE_ADJUST_TYPE","sourceConsistencyAssessable":true,"adjustTypesObserved":["QFQ"],"missingSecurityFields":["security"]}}},"contentHash":"ffffffffffffffffffffffffffffffffffffffffffffffffffffffffffffffff"}],"errors":[],"contextHash":"ffffffffffffffffffffffffffffffffffffffffffffffffffffffffffffffff","ruleVersion":"1.4.0-stage-2d-market-regime-v1","executionMode":"LOCAL_RULES","generatedAt":"2026-07-14T05:02:00Z"},{"schemaVersion":"1.0","taskId":93,"runId":332,"agentCode":"MARKET_REGIME","status":"INSUFFICIENT_DATA","gateStatus":"NOT_APPLICABLE","decision":"NOT_APPLICABLE","veto":false,"score":0,"confidence":0,"summary":"DATA_QUALITY门禁已阻断，未执行当前证券池市场宽度状态规则。","findings":[],"evidence":[],"errors":[],"contextHash":"ffffffffffffffffffffffffffffffffffffffffffffffffffffffffffffffff","ruleVersion":"1.4.0-stage-2d-market-regime-v1","executionMode":"LOCAL_RULES","generatedAt":"2026-07-14T05:02:00Z"},{"schemaVersion":"1.0","taskId":93,"runId":333,"agentCode":"TECHNICAL_ANALYSIS","status":"INSUFFICIENT_DATA","gateStatus":"NOT_APPLICABLE","decision":"NOT_APPLICABLE","veto":false,"score":0,"confidence":0,"summary":"因数据质量门禁阻断，未执行技术分析。","findings":[],"evidence":[],"errors":[],"contextHash":"ffffffffffffffffffffffffffffffffffffffffffffffffffffffffffffffff","ruleVersion":"1.4.0-stage-2d-market-regime-v1","executionMode":"LOCAL_RULES","generatedAt":"2026-07-14T05:02:00Z"},{"schemaVersion":"1.0","taskId":93,"runId":334,"agentCode":"STRATEGY_BACKTEST","status":"INSUFFICIENT_DATA","gateStatus":"NOT_APPLICABLE","decision":"NOT_APPLICABLE","veto":false,"score":0,"confidence":0,"summary":"因数据质量门禁阻断，未执行策略回测分析。","findings":[],"evidence":[],"errors":[],"contextHash":"ffffffffffffffffffffffffffffffffffffffffffffffffffffffffffffffff","ruleVersion":"1.4.0-stage-2d-market-regime-v1","executionMode":"LOCAL_RULES","generatedAt":"2026-07-14T05:02:00Z"},{"schemaVersion":"1.0","taskId":93,"runId":335,"agentCode":"ANNOUNCEMENT_RISK","status":"INSUFFICIENT_DATA","gateStatus":"NOT_APPLICABLE","decision":"NOT_APPLICABLE","veto":false,"score":0,"confidence":0,"summary":"因数据质量门禁阻断，未执行公告事件风险分析。","findings":[],"evidence":[],"errors":[],"contextHash":"ffffffffffffffffffffffffffffffffffffffffffffffffffffffffffffffff","ruleVersion":"1.4.0-stage-2d-market-regime-v1","executionMode":"LOCAL_RULES","generatedAt":"2026-07-14T05:02:00Z"},{"schemaVersion":"1.0","taskId":93,"runId":336,"agentCode":"POSITION_RISK","status":"INSUFFICIENT_DATA","gateStatus":"NOT_APPLICABLE","decision":"NOT_APPLICABLE","veto":false,"score":0,"confidence":0,"summary":"因数据质量门禁阻断且无真实仓位证据，未执行资金仓位风控分析。","findings":[],"evidence":[],"errors":[],"contextHash":"ffffffffffffffffffffffffffffffffffffffffffffffffffffffffffffffff","ruleVersion":"1.4.0-stage-2d-market-regime-v1","executionMode":"LOCAL_RULES","generatedAt":"2026-07-14T05:02:00Z"}],"evidence":[{"evidenceId":"dq-context-ffffffffffffffffffffffffffffffffffffffffffffffffffffffffffffffff","category":"DATA_QUALITY","sourceType":"JAVA_ENGINE","sourceName":"AgentContextSnapshotService","sourceRef":"contextSnapshot","symbol":"600000","tradeDate":"2026-07-14","observedAt":"2026-07-14T05:00:00Z","collectedAt":"2026-07-14T05:01:00Z","fields":{"security":{"available":false,"queriedAt":"2026-07-14T05:00:00Z","queryScope":{"symbol":"600000","tradeDate":"2026-07-14"}},"marketData":{"available":true,"queriedAt":"2026-07-14T05:00:00Z","queryScope":{"symbol":"600000","tradeDate":"2026-07-14"},"adjustType":"QFQ","requestedTradeDate":"2026-07-14","effectiveTradeDate":"2026-07-14","exactTradeDateMatch":true,"actualBars":61,"bars":[]},"technicalMetrics":{"available":true,"queriedAt":"2026-07-14T05:00:00Z","queryScope":{"symbol":"600000","tradeDate":"2026-07-14"},"formulaVersion":"JAVA_INDICATORS_V1","adjustType":"QFQ","requestedTradeDate":"2026-07-14","effectiveTradeDate":"2026-07-14","requiredBars":61,"actualBars":61,"values":{}},"dataQualityContext":{"available":true,"queriedAt":"2026-07-14T05:00:00Z","queryScope":{"symbol":"600000","tradeDate":"2026-07-14"},"facts":{"securityRecordPresent":false,"securityPlaceholderSuspected":false,"securitySourceKnown":false,"securityPointInTimeGuaranteed":false,"loadedBarCount":61,"requiredBarsForTechnicalMetrics":61,"exactTradeDatePresent":true,"requestedTradeDate":"2026-07-14","effectiveTradeDate":"2026-07-14","naturalDayLag":0,"tradingCalendarAvailable":true,"missingAmountCount":0,"missingTurnoverRateCount":0,"invalidBarCount":0,"invalidBarDates":[],"maximumObservedNaturalDayGap":1,"duplicateProtection":"PRIMARY_KEY_SYMBOL_TRADE_DATE_ADJUST_TYPE","sourceConsistencyAssessable":true,"adjustTypesObserved":["QFQ"],"missingSecurityFields":["security"]}}},"contentHash":"ffffffffffffffffffffffffffffffffffffffffffffffffffffffffffffffff"}],"vetoes":[],"finalDecision":{"schemaVersion":"1.0","taskId":93,"decision":"BLOCKED_BY_DATA_QUALITY","gateStatus":"BLOCKED","vetoed":false,"score":0,"confidence":100,"summary":"DATA_QUALITY规则发现阻断事实，总控已停止后续分析。","findings":[{"findingId":"dq-20-security-record-missing","code":"SECURITY_RECORD_MISSING","severity":"HIGH","title":"证券基础事实缺失","detail":"本地数据库中不存在请求证券的基础记录。","evidenceIds":["dq-context-ffffffffffffffffffffffffffffffffffffffffffffffffffffffffffffffff"]}],"sourceRunIds":[331,332,333,334,335,336],"vetoIds":[],"contextHash":"ffffffffffffffffffffffffffffffffffffffffffffffffffffffffffffffff","tradeDate":"2026-07-14","ruleVersion":"1.4.0-stage-2d-market-regime-v1","executionMode":"LOCAL_RULES","generatedAt":"2026-07-14T05:02:00Z"},"generatedAt":"2026-07-14T05:02:00Z"}
